16:46:23.773844 IP 192.168.233.128.55794 > 8.6.112.0.443: Flags [S], seq 61630181, win 64240, options [mss 1460,sackOK,TS val 2019458762 ecr 0,nop,wscale 7], length 0
E..<08@.@..T......p.......f........."^.........
x^~.........
16:46:23.774403 IP 8.6.112.0.443 > 192.168.233.128.55794: Flags [S.], seq 937056151, ack 61630182, win 64240, options [mss 1460], length 0
E..,......:...p.........7.W...f.`....D........
16:46:23.774425 IP 192.168.233.128.55794 > 8.6.112.0.443: Flags [.], ack 1, win 64240, length 0
E..(09@.@..g......p.......f.7.W.P..."J..
16:46:23.775518 IP 192.168.233.128.55794 > 8.6.112.0.443: Flags [P.], seq 1:518, ack 1, win 64240, length 517
E..-0:@.@..a......p.......f.7.W.P...$O................|#g..x....r9..y.F.....3.....K ..l..Nn(.L.......I*&.......{.....>.......,.0.........+./...$.(.k.#.'.g.
...9.	...3.....=.<.5./.....u.........example.com.........
...............................h2.http/1.1.........1.....*.(...........	.
...........................+.	..........-.....3.&.$... ....U!0GiQvU......rmm.._J.
....0......................................................................................................................................................................................
16:46:23.775619 IP 8.6.112.0.443 > 192.168.233.128.55794: Flags [.], ack 518, win 64240, length 0
E..(......:...p.........7.W...h.P.............

.
16:43:42.933416 IP 192.168.233.128.55384 > 8.6.112.6.443: Flags [F.], seq 518, ack 1, win 64240, length 0
E..(@S@.@..G......p..X...f)j4...P..."P..
16:43:42.933649 IP 8.6.112.6.443 > 192.168.233.128.55384: Flags [.], ack 519, win 64239, length 0
E..(......:...p........X4....f)kP.............
16:43:49.995759 IP 192.168.233.128.33468 > 8.6.112.0.443: Flags [S], seq 3102852980, win 64240, options [mss 1460,sackOK,TS val 2019304984 ecr 0,nop,wscale 7], length 0
E..<}.@.@.........p........t........"^.........
x\&.........
16:43:49.996311 IP 8.6.112.0.443 > 192.168.233.128.33468: Flags [S.], seq 85870496, ack 3102852981, win 64240, options [mss 1460], length 0
E..,......:...p...........G....u`...)Y........
16:43:49.996334 IP 192.168.233.128.33468 > 8.6.112.0.443: Flags [.], ack 1, win 64240, length 0
E..(}.@.@.........p........u..G.P..."J..
16:43:49.997477 IP 192.168.233.128.33468 > 8.6.112.0.443: Flags [P.], seq 1:518, ack 1, win 64240, length 517
E..-}.@.@.........p........u..G.P...$O...................	..QJ..D...@V.{....t...... .~....#.U.:.$.=n...'.,'....O.....>.......,.0.........+./...$.(.k.#.'.g.
...9.	...3.....=.<.5./.....u.........example.com.........
...............................h2.http/1.1.........1.....*.(...........	.
...........................+.	..........-.....3.&.$... ....1......p.i..#..]..;.6.....wK......................................................................................................................................................................................
16:43:49.997581 IP 8.6.112.0.443 > 192.168.233.128.33468: Flags [.], ack 518, win 64240, length 0
E..(......:...p...........G....zP...?.........
16:44:21.914540 IP 192.168.233.128.33468 > 8.6.112.0.443: Flags [F.], seq 518, ack 1, win 64240, length 0
E..(}.@.@.........p........z..G.P..."J..
16:44:21.914844 IP 8.6.112.0.443 > 192.168.233.128.33468: Flags [.], ack 519, win 64239, length 0
E..(......:...p...........G....{P...?.........
16:44:22.885249 IP 8.6.112.6.443 > 192.168.233.128.55384: Flags [FP.], seq 1, ack 519, win 64239, length 0
E..(......:...p........X4....f)kP.............
16:44:22.885271 IP 192.168.233.128.55384 > 8.6.112.6.443: Flags [.], ack 2, win 64240, length 0
E..(..@.@.........p..X...f)k4...P.......
16:44:45.025204 IP 8.6.112.0.443 > 192.168.233.128.33468: Flags [FP.], seq 1, ack 519, win 64239, length 0
E..(......:...p...........G....{P...?.........
16:44:45.025223 IP 192.168.233.128.33468 > 8.6.112.0.443: Flags [.], ack 2, win 64240, length 0
E..(..@.@.........p........{..G.P...?...
16:46:23.773844 IP 192.168.233.128.55794 > 8.6.112.0.443: Flags [S], seq 61630181, win 64240, options [mss 1460,sackOK,TS val 2019458762 ecr 0,nop,wscale 7], length 0
E..<08@.@..T......p.......f........."^.........
x^~.........
16:46:23.774403 IP 8.6.112.0.443 > 192.168.233.128.55794: Flags [S.], seq 937056151, ack 61630182, win 64240, options [mss 1460], length 0
E..,......:...p.........7.W...f.`....D........
16:46:23.774425 IP 192.168.233.128.55794 > 8.6.112.0.443: Flags [.], ack 1, win 64240, length 0
E..(09@.@..g......p.......f.7.W.P..."J..
16:46:23.775518 IP 192.168.233.128.55794 > 8.6.112.0.443: Flags [P.], seq 1:518, ack 1, win 64240, length 517
E..-0:@.@..a......p.......f.7.W.P...$O................|#g..x....r9..y.F.....3.....K ..l..Nn(.L.......I*&.......{.....>.......,.0.........+./...$.(.k.#.'.g.
...9.	...3.....=.<.5./.....u.........example.com.........
...............................h2.http/1.1.........1.....*.(...........	.
...........................+.	..........-.....3.&.$... ....U!0GiQvU......rmm.._J.
....0......................................................................................................................................................................................
16:46:23.775619 IP 8.6.112.0.443 > 192.168.233.128.55794: Flags [.], ack 518, win 64240, length 0
E..(......:...p.........7.W...h.P.............

# SPDX-FileCopyrightText: 2026 Nikita Vikhrov
# SPDX-License-Identifier: MIT
